{
  "$schema": "https://json-schema.org/draft/2020-12/schema",
  "$id": "https://jseverino.com/cloudflare/zone.schema.json",
  "title": "Cloudflare zone desired state",
  "description": "The zone and account posture bin/cloudflare.ts checks and applies. No account or zone IDs: both resolve at runtime from the zone name. See docs/Cloudflare.md.",
  "type": "object",
  "additionalProperties": false,
  "required": ["zone", "owner", "settings", "hsts", "dnssec", "botManagement", "firewall", "rateLimit", "preview", "schemaValidation", "turnstile"],
  "properties": {
    "$schema": { "type": "string" },
    "zone": { "description": "Zone name; the zone and its account are looked up by it.", "type": "string", "pattern": "^[a-z0-9.-]+\\.[a-z]+$" },
    "owner": {
      "description": "Ownership tag. Rules whose ref starts with '<owner>-' belong to this file; apply never edits or deletes any other rule.",
      "type": "string",
      "pattern": "^[a-z0-9][a-z0-9-]*$"
    },
    "settings": {
      "description": "Zone settings by API setting id (PATCH /zones/:zone/settings/:id).",
      "type": "object",
      "additionalProperties": false,
      "required": ["min_tls_version", "tls_1_3", "always_use_https", "http3", "0rtt", "speed_brain", "rocket_loader", "email_obfuscation", "server_side_exclude", "automatic_https_rewrites", "browser_cache_ttl", "brotli"],
      "properties": {
        "min_tls_version": { "enum": ["1.0", "1.1", "1.2", "1.3"] },
        "tls_1_3": { "enum": ["on", "off", "zrt"] },
        "always_use_https": { "$ref": "#/$defs/toggle" },
        "http3": { "$ref": "#/$defs/toggle" },
        "0rtt": { "$ref": "#/$defs/toggle" },
        "speed_brain": { "description": "On: prefetches likely next pages through a speculation-rules response header, which adds no markup.", "$ref": "#/$defs/toggle" },
        "rocket_loader": { "description": "Off: rewrites script tags, which breaks the hashed inline script.", "$ref": "#/$defs/toggle" },
        "email_obfuscation": { "description": "Off: injects a decoder script into HTML.", "$ref": "#/$defs/toggle" },
        "server_side_exclude": { "description": "Off: rewrites HTML.", "$ref": "#/$defs/toggle" },
        "automatic_https_rewrites": { "description": "Off: rewrites HTML; every URL is already https.", "$ref": "#/$defs/toggle" },
        "hotlink_protection": { "description": "Off: Cross-Origin-Resource-Policy already covers it.", "$ref": "#/$defs/toggle" },
        "browser_cache_ttl": { "description": "0 respects the origin's Cache-Control, so public/_headers decides browser TTLs.", "type": "integer", "minimum": 0 },
        "brotli": { "$ref": "#/$defs/toggle" }
      }
    },
    "hsts": {
      "description": "The security_header setting's strict_transport_security block.",
      "type": "object",
      "additionalProperties": false,
      "required": ["enabled", "max_age", "include_subdomains", "preload"],
      "properties": {
        "enabled": { "type": "boolean" },
        "max_age": { "type": "integer", "minimum": 0 },
        "include_subdomains": { "type": "boolean" },
        "preload": { "description": "Pending a decision; preload is hard to undo.", "type": "boolean" }
      }
    },
    "dnssec": { "enum": ["active", "disabled"] },
    "botManagement": {
      "description": "The zone's bot_management settings (PUT /zones/:zone/bot_management). The endpoint resets every field a PUT leaves out, so apply sends these over the live values of the fields not declared here.",
      "type": "object",
      "additionalProperties": false,
      "required": ["enable_js", "fight_mode", "ai_training", "ai_search", "ai_user"],
      "properties": {
        "enable_js": { "description": "Off: JS Detections injects an inline script with per-request values, which no CSP hash can cover.", "type": "boolean" },
        "fight_mode": { "description": "Off: Bot Fight Mode challenges visitors and turns JS Detections on.", "type": "boolean" },
        "ai_training": { "description": "AI crawlers that collect content to train models.", "type": "string", "minLength": 1 },
        "ai_search": { "description": "AI crawlers that index content for search.", "type": "string", "minLength": 1 },
        "ai_user": { "description": "AI agents fetching a page for a person's request.", "type": "string", "minLength": 1 }
      }
    },
    "firewall": {
      "description": "WAF custom rules (phase http_request_firewall_custom). At most 5 including rules made in the dashboard, which check counts; keep one free for incidents.",
      "type": "array",
      "maxItems": 4,
      "items": { "$ref": "#/$defs/rule" }
    },
    "rateLimit": {
      "description": "The one rate-limiting rule (phase http_ratelimit): path and verified-bot fields, per IP and colo, 10 s period and block.",
      "type": "object",
      "additionalProperties": false,
      "required": ["id", "description", "expression", "action", "characteristics", "period", "requests_per_period", "mitigation_timeout"],
      "properties": {
        "id": { "$ref": "#/$defs/id" },
        "description": { "type": "string", "minLength": 1 },
        "expression": { "type": "string", "minLength": 1 },
        "action": { "const": "block" },
        "characteristics": { "type": "array", "items": { "type": "string" }, "minItems": 1 },
        "period": { "const": 10 },
        "requests_per_period": { "type": "integer", "minimum": 1 },
        "mitigation_timeout": { "const": 10 }
      }
    },
    "preview": {
      "description": "The Worker's preview URLs, every one under the PREVIEW_HOST_SUFFIX wildcard (src/lib/site-config.ts).",
      "type": "object",
      "additionalProperties": false,
      "required": ["accessPolicy"],
      "properties": {
        "accessPolicy": {
          "description": "An Access application covers the preview wildcard, and every policy on it is Service Auth whose include rules are service tokens only: previews are reached by CI's token and the tailnet proxy's, never by a person's identity. Check-only: apply never edits Access.",
          "enum": ["service-auth-only"]
        }
      }
    },
    "schemaValidation": {
      "description": "API Shield schema validation for the contact endpoint. Block is the only action offered.",
      "type": "object",
      "additionalProperties": false,
      "required": ["name", "file", "host", "method", "endpoint", "action"],
      "properties": {
        "name": { "type": "string", "minLength": 1 },
        "file": { "type": "string", "pattern": "\\.json$" },
        "host": { "type": "string", "minLength": 1 },
        "method": { "enum": ["POST"] },
        "endpoint": { "type": "string", "pattern": "^/" },
        "action": { "const": "block" }
      }
    },
    "turnstile": {
      "description": "The Turnstile widget serving the zone, found by hostname.",
      "type": "object",
      "additionalProperties": false,
      "required": ["domains"],
      "properties": {
        "domains": { "type": "array", "items": { "type": "string" }, "minItems": 1 }
      }
    }
  },
  "$defs": {
    "toggle": { "enum": ["on", "off"] },
    "id": { "type": "string", "pattern": "^[a-z0-9][a-z0-9-]*$" },
    "rule": {
      "type": "object",
      "additionalProperties": false,
      "required": ["id", "description", "expression", "action"],
      "properties": {
        "id": { "$ref": "#/$defs/id" },
        "description": { "type": "string", "minLength": 1 },
        "expression": { "type": "string", "minLength": 1 },
        "action": { "enum": ["block", "managed_challenge"] }
      }
    }
  }
}
