{
  "$schema": "./zone.schema.json",
  "zone": "jseverino.com",
  "owner": "jseverino-com",
  "settings": {
    "min_tls_version": "1.3",
    "tls_1_3": "on",
    "always_use_https": "on",
    "http3": "on",
    "0rtt": "off",
    "speed_brain": "on",
    "rocket_loader": "off",
    "email_obfuscation": "off",
    "server_side_exclude": "off",
    "automatic_https_rewrites": "off",
    "hotlink_protection": "off",
    "browser_cache_ttl": 0,
    "brotli": "on"
  },
  "hsts": {
    "enabled": true,
    "max_age": 31536000,
    "include_subdomains": true,
    "preload": false
  },
  "dnssec": "active",
  "botManagement": {
    "enable_js": false,
    "fight_mode": false,
    "ai_training": "disallow",
    "ai_search": "disabled",
    "ai_user": "disabled"
  },
  "firewall": [
    {
      "id": "api-request",
      "description": "API requests are POST, with the media type their handler reads",
      "expression": "(starts_with(http.request.uri.path, \"/api/\") and http.request.method ne \"POST\") or (http.request.uri.path eq \"/api/contact\" and not any(http.request.headers[\"content-type\"][*] wildcard \"application/json*\")) or (http.request.uri.path eq \"/api/csp-report\" and not any(http.request.headers[\"content-type\"][*] wildcard \"application/csp-report*\") and not any(http.request.headers[\"content-type\"][*] wildcard \"application/reports+json*\") and not any(http.request.headers[\"content-type\"][*] wildcard \"application/json*\"))",
      "action": "block"
    },
    {
      "id": "sitedrift-production",
      "description": "The preview review proxy never answers on the production hosts",
      "expression": "(http.host in {\"jseverino.com\" \"www.jseverino.com\"} and starts_with(http.request.uri.path, \"/__sitedrift\"))",
      "action": "block"
    }
  ],
  "rateLimit": {
    "id": "api-rate",
    "description": "15 API requests per 10 seconds per IP",
    "expression": "(starts_with(http.request.uri.path, \"/api/\"))",
    "action": "block",
    "characteristics": ["cf.colo.id", "ip.src"],
    "period": 10,
    "requests_per_period": 15,
    "mitigation_timeout": 10
  },
  "preview": {
    "accessPolicy": "service-auth-only"
  },
  "schemaValidation": {
    "name": "jseverino-com-contact",
    "file": "contracts/contact.openapi.json",
    "host": "jseverino.com",
    "method": "POST",
    "endpoint": "/api/contact",
    "action": "block"
  },
  "turnstile": {
    "domains": ["jseverino.com"]
  }
}
